{
  "schema_version": "0.3",
  "run_id": "20260929T152327-pledge-84ab",
  "is_mock": false,
  "source": {
    "file_id": "sha256:33af8e040ec9850a",
    "file_name": "D3-PLD-003.txt",
    "file_sha256": "33af8e040ec9850a6e3324697620136f0de95201777f67228489c8717fcc3151",
    "parse_meta": {
      "parser_version": null,
      "page_count": 1,
      "blocks": null
    }
  },
  "events": [
    {
      "event_id": "E01",
      "event_type": "pledge",
      "fields": {
        "direction": {
          "raw_value": "补充质押",
          "value": "pledge",
          "unit": "text",
          "standardized": true,
          "status": "extracted",
          "provenance": [
            {
              "block_id": null,
              "page": 1,
              "region": null,
              "table_id": null,
              "cell_ref": null,
              "source_type": null,
              "quote": "补充质押"
            }
          ],
          "denominator": null,
          "note": null
        },
        "pledgor": {
          "raw_value": "江西鑫盛",
          "value": "江西鑫盛",
          "unit": "text",
          "standardized": true,
          "status": "extracted",
          "provenance": [
            {
              "block_id": null,
              "page": 1,
              "region": null,
              "table_id": null,
              "cell_ref": null,
              "source_type": null,
              "quote": "江西鑫盛"
            }
          ],
          "denominator": null,
          "note": null
        },
        "pledgee": {
          "raw_value": "泰州国锐融资租赁有限公司",
          "value": "泰州国锐融资租赁有限公司",
          "unit": "text",
          "standardized": true,
          "status": "extracted",
          "provenance": [
            {
              "block_id": null,
              "page": 1,
              "region": null,
              "table_id": null,
              "cell_ref": null,
              "source_type": null,
              "quote": "泰州国锐融资租赁有限公司"
            }
          ],
          "denominator": null,
          "note": null
        },
        "pledged_shares_this_time": {
          "raw_value": "2,000,000",
          "value": 2000000,
          "unit": "shares",
          "standardized": true,
          "status": "extracted",
          "provenance": [
            {
              "block_id": null,
              "page": 1,
              "region": null,
              "table_id": null,
              "cell_ref": null,
              "source_type": null,
              "quote": "2,000,000"
            }
          ],
          "denominator": null,
          "note": null
        },
        "pledged_shares_cumulative": {
          "raw_value": "80,000,000",
          "value": 80000000,
          "unit": "shares",
          "standardized": true,
          "status": "extracted",
          "provenance": [
            {
              "block_id": null,
              "page": 1,
              "region": null,
              "table_id": null,
              "cell_ref": null,
              "source_type": null,
              "quote": "80,000,000"
            }
          ],
          "denominator": null,
          "note": null
        },
        "pledged_ratio_this_time_of_held": {
          "raw_value": "2.18",
          "value": 2.18,
          "unit": "percent",
          "standardized": true,
          "status": "extracted",
          "provenance": [
            {
              "block_id": null,
              "page": 1,
              "region": null,
              "table_id": null,
              "cell_ref": null,
              "source_type": null,
              "quote": "2.18"
            }
          ],
          "denominator": "holder_shares",
          "note": null
        },
        "pledged_ratio_this_time_of_total": {
          "raw_value": "0.19",
          "value": 0.19,
          "unit": "percent",
          "standardized": true,
          "status": "extracted",
          "provenance": [
            {
              "block_id": null,
              "page": 1,
              "region": null,
              "table_id": null,
              "cell_ref": null,
              "source_type": null,
              "quote": "0.19"
            }
          ],
          "denominator": "total_share_capital",
          "note": null
        },
        "pledged_ratio_cumulative_of_held": {
          "raw_value": "87.35",
          "value": 87.35,
          "unit": "percent",
          "standardized": true,
          "status": "extracted",
          "provenance": [
            {
              "block_id": null,
              "page": 1,
              "region": null,
              "table_id": null,
              "cell_ref": null,
              "source_type": null,
              "quote": "87.35"
            }
          ],
          "denominator": "holder_shares",
          "note": null
        },
        "pledged_ratio_cumulative_of_total": {
          "raw_value": "7.56",
          "value": 7.56,
          "unit": "percent",
          "standardized": true,
          "status": "extracted",
          "provenance": [
            {
              "block_id": null,
              "page": 1,
              "region": null,
              "table_id": null,
              "cell_ref": null,
              "source_type": null,
              "quote": "7.56"
            }
          ],
          "denominator": "total_share_capital",
          "note": null
        },
        "pledge_amount": {
          "raw_value": null,
          "value": null,
          "unit": "cny",
          "standardized": false,
          "status": "not_mentioned",
          "provenance": [],
          "denominator": null,
          "note": null
        },
        "start_date": {
          "raw_value": "2026年9月24日",
          "value": "2026-09-24",
          "unit": "date",
          "standardized": true,
          "status": "extracted",
          "provenance": [
            {
              "block_id": null,
              "page": 1,
              "region": null,
              "table_id": null,
              "cell_ref": null,
              "source_type": null,
              "quote": "2026年9月24日"
            }
          ],
          "denominator": null,
          "note": null
        },
        "end_date": {
          "raw_value": "办理解除质押登记手续之日",
          "value": null,
          "unit": "date",
          "standardized": false,
          "status": "needs_review",
          "provenance": [
            {
              "block_id": null,
              "page": 1,
              "region": null,
              "table_id": null,
              "cell_ref": null,
              "source_type": null,
              "quote": "办理解除质押登记手续之日"
            }
          ],
          "denominator": null,
          "note": null
        },
        "purpose": {
          "raw_value": "补充质押",
          "value": "补充质押",
          "unit": "text",
          "standardized": true,
          "status": "extracted",
          "provenance": [
            {
              "block_id": null,
              "page": 1,
              "region": null,
              "table_id": null,
              "cell_ref": null,
              "source_type": null,
              "quote": "补充质押"
            }
          ],
          "denominator": null,
          "note": null
        },
        "announcement_date": {
          "raw_value": "二〇二六年九月二十九日",
          "value": "2026-09-29",
          "unit": "date",
          "standardized": true,
          "status": "extracted",
          "provenance": [
            {
              "block_id": null,
              "page": 1,
              "region": null,
              "table_id": null,
              "cell_ref": null,
              "source_type": null,
              "quote": "二〇二六年九月二十九日"
            }
          ],
          "denominator": null,
          "note": null
        }
      },
      "extraction_method": "model",
      "notes": null
    }
  ],
  "run_meta": {
    "entry": "cli",
    "model": "deepseek-chat",
    "started_at": "2026-09-29T15:23:27.410Z",
    "duration_ms": 3877,
    "errors": []
  }
}