{
  "schema_version": "0.3",
  "run_id": "20260929T014924-pledge-6cf7",
  "is_mock": false,
  "source": {
    "file_id": "sha256:ad6b1a20978cd7b5",
    "file_name": "D2-PLD-001.txt",
    "file_sha256": "ad6b1a20978cd7b59278db90ce9f158a034c7da408b4572fc16fb9460744a825",
    "parse_meta": {
      "parser_version": null,
      "page_count": 1,
      "blocks": null
    }
  },
  "events": [
    {
      "event_id": "E01",
      "event_type": "pledge",
      "fields": {
        "pledgor": {
          "raw_value": "某某制造股份有限公司股东",
          "value": "某某制造股份有限公司股东",
          "unit": "text",
          "standardized": true,
          "status": "extracted",
          "provenance": [
            {
              "block_id": null,
              "page": 1,
              "region": null,
              "table_id": null,
              "cell_ref": null,
              "quote": "股东质押1,000万股给华城银行"
            }
          ],
          "denominator": null,
          "note": null
        },
        "pledgee": {
          "raw_value": "华城银行",
          "value": "华城银行",
          "unit": "text",
          "standardized": true,
          "status": "extracted",
          "provenance": [
            {
              "block_id": null,
              "page": 1,
              "region": null,
              "table_id": null,
              "cell_ref": null,
              "quote": "股东质押1,000万股给华城银行"
            }
          ],
          "denominator": null,
          "note": null
        },
        "pledged_shares_this_time": {
          "raw_value": "1,000万股",
          "value": 10000000,
          "unit": "shares",
          "standardized": true,
          "status": "extracted",
          "provenance": [
            {
              "block_id": null,
              "page": 1,
              "region": null,
              "table_id": null,
              "cell_ref": null,
              "quote": "股东质押1,000万股给华城银行"
            }
          ],
          "denominator": null,
          "note": null
        },
        "pledged_shares_cumulative": {
          "raw_value": "3,000万股",
          "value": 30000000,
          "unit": "shares",
          "standardized": true,
          "status": "extracted",
          "provenance": [
            {
              "block_id": null,
              "page": 1,
              "region": null,
              "table_id": null,
              "cell_ref": null,
              "quote": "累计质押3,000万股"
            }
          ],
          "denominator": null,
          "note": null
        },
        "pledged_ratio_this_time_of_held": {
          "raw_value": "12.5%",
          "value": 12.5,
          "unit": "percent",
          "standardized": true,
          "status": "extracted",
          "provenance": [
            {
              "block_id": null,
              "page": 1,
              "region": null,
              "table_id": null,
              "cell_ref": null,
              "quote": "占其所持股份12.5%"
            }
          ],
          "denominator": "holder_shares",
          "note": null
        },
        "pledged_ratio_this_time_of_total": {
          "raw_value": "3.1%",
          "value": 3.1,
          "unit": "percent",
          "standardized": true,
          "status": "extracted",
          "provenance": [
            {
              "block_id": null,
              "page": 1,
              "region": null,
              "table_id": null,
              "cell_ref": null,
              "quote": "占公司总股本3.1%"
            }
          ],
          "denominator": "total_share_capital",
          "note": null
        },
        "pledged_ratio_cumulative_of_held": {
          "raw_value": "37.5%",
          "value": 37.5,
          "unit": "percent",
          "standardized": true,
          "status": "extracted",
          "provenance": [
            {
              "block_id": null,
              "page": 1,
              "region": null,
              "table_id": null,
              "cell_ref": null,
              "quote": "占其所持股份37.5%"
            }
          ],
          "denominator": "holder_shares",
          "note": null
        },
        "pledged_ratio_cumulative_of_total": {
          "raw_value": "9.3%",
          "value": 9.3,
          "unit": "percent",
          "standardized": true,
          "status": "extracted",
          "provenance": [
            {
              "block_id": null,
              "page": 1,
              "region": null,
              "table_id": null,
              "cell_ref": null,
              "quote": "占公司总股本9.3%"
            }
          ],
          "denominator": "total_share_capital",
          "note": null
        },
        "pledge_amount": {
          "raw_value": null,
          "value": null,
          "unit": "cny",
          "standardized": false,
          "status": "not_mentioned",
          "provenance": [],
          "denominator": null,
          "note": null
        },
        "start_date": {
          "raw_value": "2026年9月1日",
          "value": "2026-09-01",
          "unit": "date",
          "standardized": true,
          "status": "extracted",
          "provenance": [
            {
              "block_id": null,
              "page": 1,
              "region": null,
              "table_id": null,
              "cell_ref": null,
              "quote": "质押起始日2026年9月1日"
            }
          ],
          "denominator": null,
          "note": null
        },
        "end_date": {
          "raw_value": "2027年8月31日",
          "value": "2027-08-31",
          "unit": "date",
          "standardized": true,
          "status": "extracted",
          "provenance": [
            {
              "block_id": null,
              "page": 1,
              "region": null,
              "table_id": null,
              "cell_ref": null,
              "quote": "到期日2027年8月31日"
            }
          ],
          "denominator": null,
          "note": null
        },
        "purpose": {
          "raw_value": "补充流动资金",
          "value": "补充流动资金",
          "unit": "text",
          "standardized": true,
          "status": "extracted",
          "provenance": [
            {
              "block_id": null,
              "page": 1,
              "region": null,
              "table_id": null,
              "cell_ref": null,
              "quote": "用途补充流动资金"
            }
          ],
          "denominator": null,
          "note": null
        },
        "announcement_date": {
          "raw_value": "2026年9月2日",
          "value": "2026-09-02",
          "unit": "date",
          "standardized": true,
          "status": "extracted",
          "provenance": [
            {
              "block_id": null,
              "page": 1,
              "region": null,
              "table_id": null,
              "cell_ref": null,
              "quote": "2026年9月2日，某某制造股份有限公司公告"
            }
          ],
          "denominator": null,
          "note": null
        }
      },
      "extraction_method": "model",
      "notes": null
    }
  ],
  "run_meta": {
    "entry": "cli",
    "model": "deepseek-chat",
    "started_at": "2026-09-29T01:49:24.676Z",
    "duration_ms": 3360,
    "errors": []
  }
}