{
  "schema_version": "0.3",
  "run_id": "20260929T015053-pledge-cb2d",
  "is_mock": false,
  "source": {
    "file_id": "sha256:178d025b1d66d78d",
    "file_name": "D2-PLD-002.txt",
    "file_sha256": "178d025b1d66d78df927d2c1c4b93ab03301fc6d2863b64e25f30aef55d82b48",
    "parse_meta": {
      "parser_version": null,
      "page_count": 1,
      "blocks": null
    }
  },
  "events": [
    {
      "event_id": "E01",
      "event_type": "pledge",
      "fields": {
        "pledgor": {
          "raw_value": "某公司股东",
          "value": "某公司股东",
          "unit": "text",
          "standardized": true,
          "status": "extracted",
          "provenance": [
            {
              "block_id": null,
              "page": 1,
              "region": null,
              "table_id": null,
              "cell_ref": null,
              "quote": "某公司股东质押500万股给海城证券"
            }
          ],
          "denominator": null,
          "note": null
        },
        "pledgee": {
          "raw_value": "海城证券",
          "value": "海城证券",
          "unit": "text",
          "standardized": true,
          "status": "extracted",
          "provenance": [
            {
              "block_id": null,
              "page": 1,
              "region": null,
              "table_id": null,
              "cell_ref": null,
              "quote": "质押500万股给海城证券"
            }
          ],
          "denominator": null,
          "note": null
        },
        "pledged_shares_this_time": {
          "raw_value": "500万股",
          "value": 5000000,
          "unit": "shares",
          "standardized": true,
          "status": "extracted",
          "provenance": [
            {
              "block_id": null,
              "page": 1,
              "region": null,
              "table_id": null,
              "cell_ref": null,
              "quote": "质押500万股给海城证券"
            }
          ],
          "denominator": null,
          "note": null
        },
        "pledged_shares_cumulative": {
          "raw_value": "2,000万股",
          "value": 20000000,
          "unit": "shares",
          "standardized": true,
          "status": "extracted",
          "provenance": [
            {
              "block_id": null,
              "page": 1,
              "region": null,
              "table_id": null,
              "cell_ref": null,
              "quote": "累计质押2,000万股"
            }
          ],
          "denominator": null,
          "note": null
        },
        "pledged_ratio_this_time_of_held": {
          "raw_value": "5%",
          "value": 5,
          "unit": "percent",
          "standardized": true,
          "status": "extracted",
          "provenance": [
            {
              "block_id": null,
              "page": 1,
              "region": null,
              "table_id": null,
              "cell_ref": null,
              "quote": "占其所持股份5%"
            }
          ],
          "denominator": "holder_shares",
          "note": null
        },
        "pledged_ratio_this_time_of_total": {
          "raw_value": "1%",
          "value": 1,
          "unit": "percent",
          "standardized": true,
          "status": "extracted",
          "provenance": [
            {
              "block_id": null,
              "page": 1,
              "region": null,
              "table_id": null,
              "cell_ref": null,
              "quote": "占公司总股本1%"
            }
          ],
          "denominator": "total_share_capital",
          "note": null
        },
        "pledged_ratio_cumulative_of_held": {
          "raw_value": "20%",
          "value": 20,
          "unit": "percent",
          "standardized": true,
          "status": "extracted",
          "provenance": [
            {
              "block_id": null,
              "page": 1,
              "region": null,
              "table_id": null,
              "cell_ref": null,
              "quote": "占其所持股份20%"
            }
          ],
          "denominator": "holder_shares",
          "note": null
        },
        "pledged_ratio_cumulative_of_total": {
          "raw_value": "4%",
          "value": 4,
          "unit": "percent",
          "standardized": true,
          "status": "extracted",
          "provenance": [
            {
              "block_id": null,
              "page": 1,
              "region": null,
              "table_id": null,
              "cell_ref": null,
              "quote": "占公司总股本4%"
            }
          ],
          "denominator": "total_share_capital",
          "note": null
        },
        "pledge_amount": {
          "raw_value": null,
          "value": null,
          "unit": "cny",
          "standardized": false,
          "status": "not_mentioned",
          "provenance": [],
          "denominator": null,
          "note": null
        },
        "start_date": {
          "raw_value": "2026年9月3日",
          "value": "2026-09-03",
          "unit": "date",
          "standardized": true,
          "status": "extracted",
          "provenance": [
            {
              "block_id": null,
              "page": 1,
              "region": null,
              "table_id": null,
              "cell_ref": null,
              "quote": "质押起始日2026年9月3日"
            }
          ],
          "denominator": null,
          "note": null
        },
        "end_date": {
          "raw_value": "办理申请解除质押登记日",
          "value": null,
          "unit": "date",
          "standardized": false,
          "status": "needs_review",
          "provenance": [
            {
              "block_id": null,
              "page": 1,
              "region": null,
              "table_id": null,
              "cell_ref": null,
              "quote": "到期日办理申请解除质押登记日"
            }
          ],
          "denominator": null,
          "note": "到期日为解除质押登记日，非具体日期，无法标准化为单值"
        },
        "purpose": {
          "raw_value": null,
          "value": null,
          "unit": "text",
          "standardized": false,
          "status": "not_mentioned",
          "provenance": [],
          "denominator": null,
          "note": null
        },
        "announcement_date": {
          "raw_value": "2026年9月3日",
          "value": "2026-09-03",
          "unit": "date",
          "standardized": true,
          "status": "extracted",
          "provenance": [
            {
              "block_id": null,
              "page": 1,
              "region": null,
              "table_id": null,
              "cell_ref": null,
              "quote": "2026年9月3日，某公司股东质押500万股给海城证券"
            }
          ],
          "denominator": null,
          "note": null
        }
      },
      "extraction_method": "model",
      "notes": null
    }
  ],
  "run_meta": {
    "entry": "cli",
    "model": "deepseek-chat",
    "started_at": "2026-09-29T01:50:53.629Z",
    "duration_ms": 3378,
    "errors": []
  }
}