{
  "schema_version": "0.3",
  "run_id": "20261002T120939-pledge-0ca7",
  "is_mock": false,
  "source": {
    "file_id": "sha256:72583ce2481da4a0",
    "file_name": "D4-PLD-007.txt",
    "file_sha256": "72583ce2481da4a00064bf872246e250b94b988f7fbc6db27dab6f46e16a02b3",
    "parse_meta": {
      "parser_version": null,
      "page_count": 1,
      "blocks": null
    }
  },
  "events": [
    {
      "event_id": "E01",
      "event_type": "pledge",
      "fields": {
        "direction": {
          "raw_value": "质押",
          "value": "pledge",
          "unit": "text",
          "standardized": true,
          "status": "extracted",
          "provenance": [
            {
              "block_id": null,
              "page": 1,
              "region": null,
              "table_id": null,
              "cell_ref": null,
              "source_type": null,
              "quote": "本次股份\n质押15,050,000股后"
            }
          ],
          "denominator": null,
          "note": null
        },
        "pledgor": {
          "raw_value": "谢秉昆",
          "value": "谢秉昆",
          "unit": "text",
          "standardized": true,
          "status": "extracted",
          "provenance": [
            {
              "block_id": null,
              "page": 1,
              "region": null,
              "table_id": null,
              "cell_ref": null,
              "source_type": null,
              "quote": "控股股东谢秉昆先生"
            }
          ],
          "denominator": null,
          "note": null
        },
        "pledgee": {
          "raw_value": "国开新型政策性金融工具有限公司",
          "value": "国开新型政策性金融工具有限公司",
          "unit": "text",
          "standardized": true,
          "status": "extracted",
          "provenance": [
            {
              "block_id": null,
              "page": 1,
              "region": null,
              "table_id": null,
              "cell_ref": null,
              "source_type": null,
              "quote": "国开新型政策性金融工具有限公司"
            }
          ],
          "denominator": null,
          "note": null
        },
        "pledged_shares_this_time": {
          "raw_value": "15,050,000股",
          "value": 15050000,
          "unit": "shares",
          "standardized": true,
          "status": "extracted",
          "provenance": [
            {
              "block_id": null,
              "page": 1,
              "region": null,
              "table_id": null,
              "cell_ref": null,
              "source_type": null,
              "quote": "本次股份\n质押15,050,000股"
            }
          ],
          "denominator": null,
          "note": null
        },
        "pledged_shares_cumulative": {
          "raw_value": "165,640,550股",
          "value": 165640550,
          "unit": "shares",
          "standardized": true,
          "status": "extracted",
          "provenance": [
            {
              "block_id": null,
              "page": 1,
              "region": null,
              "table_id": null,
              "cell_ref": null,
              "source_type": null,
              "quote": "谢秉昆先生累计质押数量为165,640,550股"
            }
          ],
          "denominator": null,
          "note": null
        },
        "pledged_ratio_this_time_of_held": {
          "raw_value": "3.6097%",
          "value": 3.6097,
          "unit": "percent",
          "standardized": true,
          "status": "extracted",
          "provenance": [
            {
              "block_id": null,
              "page": 1,
              "region": null,
              "table_id": null,
              "cell_ref": null,
              "source_type": null,
              "quote": "3.6097%"
            }
          ],
          "denominator": "holder_shares",
          "note": null
        },
        "pledged_ratio_this_time_of_total": {
          "raw_value": "1.7669%",
          "value": 1.7669,
          "unit": "percent",
          "standardized": true,
          "status": "extracted",
          "provenance": [
            {
              "block_id": null,
              "page": 1,
              "region": null,
              "table_id": null,
              "cell_ref": null,
              "source_type": null,
              "quote": "1.7669%"
            }
          ],
          "denominator": "total_share_capital",
          "note": null
        },
        "pledged_ratio_cumulative_of_held": {
          "raw_value": "39.7285%",
          "value": 39.7285,
          "unit": "percent",
          "standardized": true,
          "status": "extracted",
          "provenance": [
            {
              "block_id": null,
              "page": 1,
              "region": null,
              "table_id": null,
              "cell_ref": null,
              "source_type": null,
              "quote": "占\n其持股数量的39.7285%"
            }
          ],
          "denominator": "holder_shares",
          "note": null
        },
        "pledged_ratio_cumulative_of_total": {
          "raw_value": "19.4469%",
          "value": 19.4469,
          "unit": "percent",
          "standardized": true,
          "status": "extracted",
          "provenance": [
            {
              "block_id": null,
              "page": 1,
              "region": null,
              "table_id": null,
              "cell_ref": null,
              "source_type": null,
              "quote": "占公司总股本的19.4469%"
            }
          ],
          "denominator": "total_share_capital",
          "note": null
        },
        "pledge_amount": {
          "raw_value": null,
          "value": null,
          "unit": "cny",
          "standardized": false,
          "status": "not_mentioned",
          "provenance": [],
          "denominator": null,
          "note": null
        },
        "start_date": {
          "raw_value": "2026-9-24",
          "value": "2026-09-24",
          "unit": "date",
          "standardized": true,
          "status": "extracted",
          "provenance": [
            {
              "block_id": null,
              "page": 1,
              "region": null,
              "table_id": null,
              "cell_ref": null,
              "source_type": null,
              "quote": "2026-9-24"
            }
          ],
          "denominator": null,
          "note": null
        },
        "end_date": {
          "raw_value": "办理解除质押登记手续之日",
          "value": null,
          "unit": "date",
          "standardized": false,
          "status": "needs_review",
          "provenance": [
            {
              "block_id": null,
              "page": 1,
              "region": null,
              "table_id": null,
              "cell_ref": null,
              "source_type": null,
              "quote": "办理解除质押登记手续之日"
            }
          ],
          "denominator": null,
          "note": null
        },
        "purpose": {
          "raw_value": "为上市公司融资提供增信措施",
          "value": "为上市公司融资提供增信措施",
          "unit": "text",
          "standardized": true,
          "status": "extracted",
          "provenance": [
            {
              "block_id": null,
              "page": 1,
              "region": null,
              "table_id": null,
              "cell_ref": null,
              "source_type": null,
              "quote": "为上市公司融资提供增信措施"
            }
          ],
          "denominator": null,
          "note": null
        },
        "announcement_date": {
          "raw_value": "2026年9月24日",
          "value": "2026-09-24",
          "unit": "date",
          "standardized": true,
          "status": "extracted",
          "provenance": [
            {
              "block_id": null,
              "page": 1,
              "region": null,
              "table_id": null,
              "cell_ref": null,
              "source_type": null,
              "quote": "2026年9月24日"
            }
          ],
          "denominator": null,
          "note": null
        }
      },
      "extraction_method": "model",
      "notes": null
    }
  ],
  "run_meta": {
    "entry": "cli",
    "model": "deepseek-chat",
    "started_at": "2026-10-02T12:09:39.185Z",
    "duration_ms": 3896,
    "code_version": "37afd2e3",
    "interface_version": "v0.3",
    "errors": []
  }
}