{
  "schema_version": "0.3",
  "run_id": "synthetic-award-D6",
  "is_mock": true,
  "source": {
    "file_id": "sha256:aaaaaaaaaaaaaaaaaaaaaaaaaaaaaaaaaaaaaaaaaaaaaaaaaaaaaaaaaaaaaaaa",
    "file_name": "synthetic_D6.txt",
    "file_sha256": "aaaaaaaaaaaaaaaaaaaaaaaaaaaaaaaaaaaaaaaaaaaaaaaaaaaaaaaaaaaaaaaa",
    "parse_meta": {
      "parser_version": "synthetic",
      "page_count": 1,
      "blocks": null
    }
  },
  "events": [
    {
      "event_id": "E01",
      "event_type": "award_contract",
      "extraction_method": "mock",
      "notes": null,
      "fields": {
        "bidder": {
          "raw_value": "甲公司、乙公司联合体",
          "value": "甲公司、乙公司联合体",
          "unit": "text",
          "standardized": true,
          "status": "extracted",
          "provenance": [
            {
              "block_id": "synthetic-p1-b1",
              "source_type": "paragraph",
              "page": 1,
              "region": null,
              "table_id": null,
              "cell_ref": null,
              "quote": "测试原文：人民币100万元，含税。甲公司、乙公司联合体。中标金额分配比例：甲公司60%；乙公司40%。"
            }
          ],
          "denominator": null,
          "note": null
        },
        "tenderer": {
          "raw_value": "丙公司",
          "value": "丙公司",
          "unit": "text",
          "standardized": true,
          "status": "extracted",
          "provenance": [
            {
              "block_id": "synthetic-p1-b1",
              "source_type": "paragraph",
              "page": 1,
              "region": null,
              "table_id": null,
              "cell_ref": null,
              "quote": "测试原文：人民币100万元，含税。甲公司、乙公司联合体。中标金额分配比例：甲公司60%；乙公司40%。"
            }
          ],
          "denominator": null,
          "note": null
        },
        "project_name": {
          "raw_value": "测试项目",
          "value": "测试项目",
          "unit": "text",
          "standardized": true,
          "status": "extracted",
          "provenance": [
            {
              "block_id": "synthetic-p1-b1",
              "source_type": "paragraph",
              "page": 1,
              "region": null,
              "table_id": null,
              "cell_ref": null,
              "quote": "测试原文：人民币100万元，含税。甲公司、乙公司联合体。中标金额分配比例：甲公司60%；乙公司40%。"
            }
          ],
          "denominator": null,
          "note": null
        },
        "bid_amount": {
          "raw_value": "人民币100万元",
          "value": "1000000",
          "unit": "cny",
          "standardized": true,
          "status": "extracted",
          "provenance": [
            {
              "block_id": "synthetic-p1-b1",
              "source_type": "paragraph",
              "page": 1,
              "region": null,
              "table_id": null,
              "cell_ref": null,
              "quote": "测试原文：人民币100万元，含税。甲公司、乙公司联合体。中标金额分配比例：甲公司60%；乙公司40%。"
            }
          ],
          "denominator": null,
          "note": null
        },
        "currency": {
          "raw_value": "人民币",
          "value": "CNY",
          "unit": "text",
          "standardized": true,
          "status": "extracted",
          "provenance": [
            {
              "block_id": "synthetic-p1-b1",
              "source_type": "paragraph",
              "page": 1,
              "region": null,
              "table_id": null,
              "cell_ref": null,
              "quote": "测试原文：人民币100万元，含税。甲公司、乙公司联合体。中标金额分配比例：甲公司60%；乙公司40%。"
            }
          ],
          "denominator": null,
          "note": null
        },
        "tax_included": {
          "raw_value": "含税",
          "value": "true",
          "unit": "text",
          "standardized": true,
          "status": "extracted",
          "provenance": [
            {
              "block_id": "synthetic-p1-b1",
              "source_type": "paragraph",
              "page": 1,
              "region": null,
              "table_id": null,
              "cell_ref": null,
              "quote": "测试原文：人民币100万元，含税。甲公司、乙公司联合体。中标金额分配比例：甲公司60%；乙公司40%。"
            }
          ],
          "denominator": null,
          "note": null
        },
        "duration": {
          "raw_value": null,
          "value": null,
          "unit": "text",
          "standardized": false,
          "status": "not_mentioned",
          "provenance": [],
          "denominator": null,
          "note": null
        },
        "consortium_members": {
          "raw_value": "甲公司、乙公司",
          "value": "甲公司、乙公司",
          "unit": "text",
          "standardized": true,
          "status": "extracted",
          "provenance": [
            {
              "block_id": "synthetic-p1-b1",
              "source_type": "paragraph",
              "page": 1,
              "region": null,
              "table_id": null,
              "cell_ref": null,
              "quote": "测试原文：人民币100万元，含税。甲公司、乙公司联合体。中标金额分配比例：甲公司60%；乙公司40%。"
            }
          ],
          "denominator": null,
          "note": null
        },
        "consortium_shares": {
          "raw_value": "中标金额分配比例：甲公司60%；乙公司40%",
          "value": "中标金额分配比例：甲公司60%；乙公司40%",
          "unit": "text",
          "standardized": true,
          "status": "extracted",
          "provenance": [
            {
              "block_id": "synthetic-p1-b1",
              "source_type": "paragraph",
              "page": 1,
              "region": null,
              "table_id": null,
              "cell_ref": null,
              "quote": "测试原文：人民币100万元，含税。甲公司、乙公司联合体。中标金额分配比例：甲公司60%；乙公司40%。"
            }
          ],
          "denominator": null,
          "note": null
        },
        "bid_date": {
          "raw_value": "2026年10月2日",
          "value": "2026-10-02",
          "unit": "date",
          "standardized": true,
          "status": "extracted",
          "provenance": [
            {
              "block_id": "synthetic-p1-b1",
              "source_type": "paragraph",
              "page": 1,
              "region": null,
              "table_id": null,
              "cell_ref": null,
              "quote": "测试原文：人民币100万元，含税。甲公司、乙公司联合体。中标金额分配比例：甲公司60%；乙公司40%。"
            }
          ],
          "denominator": null,
          "note": null
        },
        "contract_signed": {
          "raw_value": null,
          "value": null,
          "unit": "text",
          "standardized": false,
          "status": "not_mentioned",
          "provenance": [],
          "denominator": null,
          "note": null
        },
        "formal_award_notice_received": {
          "raw_value": null,
          "value": null,
          "unit": "text",
          "standardized": false,
          "status": "not_mentioned",
          "provenance": [],
          "denominator": null,
          "note": null
        },
        "price_adjustment_status": {
          "raw_value": null,
          "value": null,
          "unit": "text",
          "standardized": false,
          "status": "not_mentioned",
          "provenance": [],
          "denominator": null,
          "note": null
        },
        "recognized_revenue": {
          "raw_value": null,
          "value": null,
          "unit": "cny",
          "standardized": false,
          "status": "not_mentioned",
          "provenance": [],
          "denominator": null,
          "note": null
        }
      }
    }
  ],
  "run_meta": {
    "entry": "tool",
    "model": null,
    "started_at": "2026-10-02T00:00:00+08:00",
    "duration_ms": 0,
    "errors": []
  }
}
