{
  "schema_version": "0.3",
  "run_id": "20260930T092451-pledge-b927",
  "is_mock": false,
  "source": {
    "file_id": "sha256:124cddec269bf044",
    "file_name": "D4-PLD-006.txt",
    "file_sha256": "124cddec269bf044ad6ab2ed22e4750100cbae7e4d8a243823bf64153db9bcc7",
    "parse_meta": {
      "parser_version": null,
      "page_count": 1,
      "blocks": null
    }
  },
  "events": [
    {
      "event_id": "E01",
      "event_type": "pledge",
      "fields": {
        "direction": {
          "raw_value": "质押",
          "value": "pledge",
          "unit": "text",
          "standardized": true,
          "status": "extracted",
          "provenance": [
            {
              "block_id": null,
              "page": 1,
              "region": null,
              "table_id": null,
              "cell_ref": null,
              "source_type": null,
              "quote": "本次办理股份质押业务后"
            }
          ],
          "denominator": null,
          "note": null
        },
        "pledgor": {
          "raw_value": "西藏荣恩",
          "value": "西藏荣恩",
          "unit": "text",
          "standardized": true,
          "status": "extracted",
          "provenance": [
            {
              "block_id": null,
              "page": 1,
              "region": null,
              "table_id": null,
              "cell_ref": null,
              "source_type": null,
              "quote": "股东名称\n是否为控股股东\n本次质押股数\n是否为限售股\n是否补充质押\n质押起始日\n质押到期日\n质权人\n占其所持股份比例\n占公司总股本比例\n质押融资资金用途\n西藏荣恩"
            }
          ],
          "denominator": null,
          "note": null
        },
        "pledgee": {
          "raw_value": "上海浦东发展银行股份有限公司成都分行",
          "value": "上海浦东发展银行股份有限公司成都分行",
          "unit": "text",
          "standardized": true,
          "status": "extracted",
          "provenance": [
            {
              "block_id": null,
              "page": 1,
              "region": null,
              "table_id": null,
              "cell_ref": null,
              "source_type": null,
              "quote": "上海浦东发展银行股份有限公司成都分行"
            }
          ],
          "denominator": null,
          "note": null
        },
        "pledged_shares_this_time": {
          "raw_value": "375万股",
          "value": 3750000,
          "unit": "shares",
          "standardized": true,
          "status": "extracted",
          "provenance": [
            {
              "block_id": null,
              "page": 1,
              "region": null,
              "table_id": null,
              "cell_ref": null,
              "source_type": null,
              "quote": "375万股"
            }
          ],
          "denominator": null,
          "note": null
        },
        "pledged_shares_cumulative": {
          "raw_value": "11,781万股",
          "value": 117810000,
          "unit": "shares",
          "standardized": true,
          "status": "extracted",
          "provenance": [
            {
              "block_id": null,
              "page": 1,
              "region": null,
              "table_id": null,
              "cell_ref": null,
              "source_type": null,
              "quote": "11,781万股"
            }
          ],
          "denominator": null,
          "note": null
        },
        "pledged_ratio_this_time_of_held": {
          "raw_value": "1.99%",
          "value": 1.99,
          "unit": "percent",
          "standardized": true,
          "status": "extracted",
          "provenance": [
            {
              "block_id": null,
              "page": 1,
              "region": null,
              "table_id": null,
              "cell_ref": null,
              "source_type": null,
              "quote": "1.99%"
            }
          ],
          "denominator": "holder_shares",
          "note": null
        },
        "pledged_ratio_this_time_of_total": {
          "raw_value": "0.64%",
          "value": 0.64,
          "unit": "percent",
          "standardized": true,
          "status": "extracted",
          "provenance": [
            {
              "block_id": null,
              "page": 1,
              "region": null,
              "table_id": null,
              "cell_ref": null,
              "source_type": null,
              "quote": "0.64%"
            }
          ],
          "denominator": "total_share_capital",
          "note": null
        },
        "pledged_ratio_cumulative_of_held": {
          "raw_value": "62.46%",
          "value": 62.46,
          "unit": "percent",
          "standardized": true,
          "status": "extracted",
          "provenance": [
            {
              "block_id": null,
              "page": 1,
              "region": null,
              "table_id": null,
              "cell_ref": null,
              "source_type": null,
              "quote": "62.46%"
            }
          ],
          "denominator": "holder_shares",
          "note": null
        },
        "pledged_ratio_cumulative_of_total": {
          "raw_value": "20.07%",
          "value": 20.07,
          "unit": "percent",
          "standardized": true,
          "status": "extracted",
          "provenance": [
            {
              "block_id": null,
              "page": 1,
              "region": null,
              "table_id": null,
              "cell_ref": null,
              "source_type": null,
              "quote": "20.07%"
            }
          ],
          "denominator": "total_share_capital",
          "note": null
        },
        "pledge_amount": {
          "raw_value": null,
          "value": null,
          "unit": "cny",
          "standardized": false,
          "status": "not_mentioned",
          "provenance": [],
          "denominator": null,
          "note": null
        },
        "start_date": {
          "raw_value": "2026-09-22",
          "value": "2026-09-22",
          "unit": "date",
          "standardized": true,
          "status": "extracted",
          "provenance": [
            {
              "block_id": null,
              "page": 1,
              "region": null,
              "table_id": null,
              "cell_ref": null,
              "source_type": null,
              "quote": "2026-09-22"
            }
          ],
          "denominator": null,
          "note": null
        },
        "end_date": {
          "raw_value": "2029-09-18",
          "value": "2029-09-18",
          "unit": "date",
          "standardized": true,
          "status": "extracted",
          "provenance": [
            {
              "block_id": null,
              "page": 1,
              "region": null,
              "table_id": null,
              "cell_ref": null,
              "source_type": null,
              "quote": "2029-09-18"
            }
          ],
          "denominator": null,
          "note": null
        },
        "purpose": {
          "raw_value": "提供担保",
          "value": "提供担保",
          "unit": "text",
          "standardized": true,
          "status": "extracted",
          "provenance": [
            {
              "block_id": null,
              "page": 1,
              "region": null,
              "table_id": null,
              "cell_ref": null,
              "source_type": null,
              "quote": "提供担保"
            }
          ],
          "denominator": null,
          "note": null
        },
        "announcement_date": {
          "raw_value": "2026年9月24日",
          "value": "2026-09-24",
          "unit": "date",
          "standardized": true,
          "status": "extracted",
          "provenance": [
            {
              "block_id": null,
              "page": 1,
              "region": null,
              "table_id": null,
              "cell_ref": null,
              "source_type": null,
              "quote": "2026年9月24日"
            }
          ],
          "denominator": null,
          "note": null
        }
      },
      "extraction_method": "model",
      "notes": null
    }
  ],
  "run_meta": {
    "entry": "cli",
    "model": "deepseek-chat",
    "started_at": "2026-09-30T09:24:51.970Z",
    "duration_ms": 5132,
    "errors": []
  }
}