{
  "schema_version": "0.3",
  "run_id": "20260930T095314-pledge-0fd7",
  "is_mock": false,
  "source": {
    "file_id": "sha256:4b82f48f8873c65f",
    "file_name": "D4-PLD-004.txt",
    "file_sha256": "4b82f48f8873c65f1188c78d0b4fa8d0c8bf2b71bc3ca47bbd4090c2d59b52b6",
    "parse_meta": {
      "parser_version": null,
      "page_count": 1,
      "blocks": null
    }
  },
  "events": [
    {
      "event_id": "E01",
      "event_type": "pledge",
      "fields": {
        "direction": {
          "raw_value": "质押",
          "value": "pledge",
          "unit": "text",
          "standardized": true,
          "status": "extracted",
          "provenance": [
            {
              "block_id": null,
              "page": 1,
              "region": null,
              "table_id": null,
              "cell_ref": null,
              "source_type": null,
              "quote": "办理了质押登记手续"
            }
          ],
          "denominator": null,
          "note": null
        },
        "pledgor": {
          "raw_value": "南通乾创",
          "value": "南通乾创",
          "unit": "text",
          "standardized": true,
          "status": "extracted",
          "provenance": [
            {
              "block_id": null,
              "page": 1,
              "region": null,
              "table_id": null,
              "cell_ref": null,
              "source_type": null,
              "quote": "南通乾创"
            }
          ],
          "denominator": null,
          "note": null
        },
        "pledgee": {
          "raw_value": "平安银行股份有限公司深圳分行",
          "value": "平安银行股份有限公司深圳分行",
          "unit": "text",
          "standardized": true,
          "status": "extracted",
          "provenance": [
            {
              "block_id": null,
              "page": 1,
              "region": null,
              "table_id": null,
              "cell_ref": null,
              "source_type": null,
              "quote": "平安银行股份有限公司深圳分行"
            }
          ],
          "denominator": null,
          "note": null
        },
        "pledged_shares_this_time": {
          "raw_value": "364.00万股",
          "value": 3640000,
          "unit": "shares",
          "standardized": true,
          "status": "extracted",
          "provenance": [
            {
              "block_id": null,
              "page": 1,
              "region": null,
              "table_id": null,
              "cell_ref": null,
              "source_type": null,
              "quote": "364.00"
            }
          ],
          "denominator": null,
          "note": null
        },
        "pledged_shares_cumulative": {
          "raw_value": "27,495.8065万股",
          "value": 274958065,
          "unit": "shares",
          "standardized": true,
          "status": "extracted",
          "provenance": [
            {
              "block_id": null,
              "page": 1,
              "region": null,
              "table_id": null,
              "cell_ref": null,
              "source_type": null,
              "quote": "27,495.8065"
            }
          ],
          "denominator": null,
          "note": null
        },
        "pledged_ratio_this_time_of_held": {
          "raw_value": "0.84%",
          "value": 0.84,
          "unit": "percent",
          "standardized": true,
          "status": "extracted",
          "provenance": [
            {
              "block_id": null,
              "page": 1,
              "region": null,
              "table_id": null,
              "cell_ref": null,
              "source_type": null,
              "quote": "0.84%"
            }
          ],
          "denominator": "holder_shares",
          "note": null
        },
        "pledged_ratio_this_time_of_total": {
          "raw_value": "0.15%",
          "value": 0.15,
          "unit": "percent",
          "standardized": true,
          "status": "extracted",
          "provenance": [
            {
              "block_id": null,
              "page": 1,
              "region": null,
              "table_id": null,
              "cell_ref": null,
              "source_type": null,
              "quote": "0.15%"
            }
          ],
          "denominator": "total_share_capital",
          "note": null
        },
        "pledged_ratio_cumulative_of_held": {
          "raw_value": "63.67%",
          "value": 63.67,
          "unit": "percent",
          "standardized": true,
          "status": "extracted",
          "provenance": [
            {
              "block_id": null,
              "page": 1,
              "region": null,
              "table_id": null,
              "cell_ref": null,
              "source_type": null,
              "quote": "63.67%"
            }
          ],
          "denominator": "holder_shares",
          "note": null
        },
        "pledged_ratio_cumulative_of_total": {
          "raw_value": "11.51%",
          "value": 11.51,
          "unit": "percent",
          "standardized": true,
          "status": "extracted",
          "provenance": [
            {
              "block_id": null,
              "page": 1,
              "region": null,
              "table_id": null,
              "cell_ref": null,
              "source_type": null,
              "quote": "11.51%"
            }
          ],
          "denominator": "total_share_capital",
          "note": null
        },
        "pledge_amount": {
          "raw_value": null,
          "value": null,
          "unit": "cny",
          "standardized": false,
          "status": "not_mentioned",
          "provenance": [],
          "denominator": null,
          "note": null
        },
        "start_date": {
          "raw_value": "2026年09月23日",
          "value": "2026-09-23",
          "unit": "date",
          "standardized": true,
          "status": "extracted",
          "provenance": [
            {
              "block_id": null,
              "page": 1,
              "region": null,
              "table_id": null,
              "cell_ref": null,
              "source_type": null,
              "quote": "2026年09月23日"
            }
          ],
          "denominator": null,
          "note": null
        },
        "end_date": {
          "raw_value": "至办理解除质押登记之日",
          "value": null,
          "unit": "date",
          "standardized": false,
          "status": "needs_review",
          "provenance": [
            {
              "block_id": null,
              "page": 1,
              "region": null,
              "table_id": null,
              "cell_ref": null,
              "source_type": null,
              "quote": "至办理解除质押登记之日"
            }
          ],
          "denominator": null,
          "note": null
        },
        "purpose": {
          "raw_value": "质押担保",
          "value": "质押担保",
          "unit": "text",
          "standardized": true,
          "status": "extracted",
          "provenance": [
            {
              "block_id": null,
              "page": 1,
              "region": null,
              "table_id": null,
              "cell_ref": null,
              "source_type": null,
              "quote": "质押担保"
            }
          ],
          "denominator": null,
          "note": null
        },
        "announcement_date": {
          "raw_value": "2026年09月28日",
          "value": "2026-09-28",
          "unit": "date",
          "standardized": true,
          "status": "extracted",
          "provenance": [
            {
              "block_id": null,
              "page": 1,
              "region": null,
              "table_id": null,
              "cell_ref": null,
              "source_type": null,
              "quote": "2026年09月28日"
            }
          ],
          "denominator": null,
          "note": null
        }
      },
      "extraction_method": "model",
      "notes": null
    }
  ],
  "run_meta": {
    "entry": "cli",
    "model": "deepseek-chat",
    "started_at": "2026-09-30T09:53:14.985Z",
    "duration_ms": 3493,
    "errors": []
  }
}